{
  "schema_version": 1,
  "generated": "2026-08-27T10:09:50-04:00",
  "project": {
    "name": "mavlink_02",
    "path": "/home/robertvanvossen/dev/agentic-hamr-experiments-02/mavlink_02"
  },
  "manifest": {
    "schema_version": 1,
    "experiment_id": "mavlink_02",
    "lifecycle": "change",
    "workflow": "ChangeExec(CR-01)",
    "profile": "audited",
    "actor": "agent",
    "harness": "codex",
    "concept_quote": "# Reduce potential cyber attacks by adding a mavlink firewall that can blacklist certain mavlink commands/messages\n\n## Goals for updated system functionality\nIncrease the cyber resilience of the system by adding a protocol specific firewall which can reject specific or malformed mavlink messages before they can make it to the Ardupilot software running in the VM. THe mavlink firewall should reject any messages that can update firmware.",
    "concept_sha256": "90eb65e0daa6fe4a6733366be7b8fe486c6c04b0f13b020e342cef545e430a45",
    "project_dir": ".",
    "session_metrics": "experiment-reports/session-metrics.json",
    "metrics_cover_full_run": true,
    "known_exclusions": [
      "Subagent activity is excluded by the schema-v2 session metrics adapter.",
      "Actual billed cost is unavailable; session cost is API list-price equivalent only.",
      "No pristine generation baseline was prepared; generate-once non-marker provenance remains unknown."
    ],
    "hamr_version": null,
    "generation_baseline": null
  },
  "measures_ref": "/home/robertvanvossen/dev/agentic-hamr-experiments-02/mavlink_02/experiment-reports/project-measures.json",
  "estimator": {
    "model": "linear_sloc_v1",
    "config_sha256": "f4818bf48820c984fef3c5ecde38c9940543990e91816a3bbecce8e749618bb4",
    "calibration_status": "uncalibrated_placeholder",
    "scope_note": "Models coding and unit-debug effort only. Excludes deployment, CI, board bring-up, assurance-case authoring, requirements elicitation meetings, and team coordination overheads."
  },
  "counterfactual": {
    "config_sha256": "39507c77cdeb96f70a04159e74beb9ec49a33772ec88b1893daa63265d1eebb9",
    "assignments": {
      "common_both_paths": {
        "sloc": 795,
        "by_artifact_type": {
          "requirements_text": 421,
          "sysml_model": 374
        }
      },
      "hamr_generated_manual_replacement": {
        "sloc": 13850,
        "by_artifact_type": {
          "build_config": 41,
          "c_infra": 1834,
          "makefile": 3598,
          "microkit_config": 572,
          "rust_contract_woven": 709,
          "rust_infra": 6082,
          "rust_test_infra": 1014
        }
      },
      "hamr_path_authored": {
        "sloc": 326,
        "by_artifact_type": {
          "gumbo_contract": 326
        }
      },
      "unknown_provenance": {
        "sloc": 341130,
        "by_artifact_type": {
          "build_config": 157,
          "c_infra": 125303,
          "c_user_code": 65,
          "docs": 214119,
          "makefile": 144,
          "microkit_config": 12,
          "rust_app_code": 722,
          "rust_infra": 250,
          "rust_test_code": 350,
          "rust_test_infra": 8
        }
      }
    }
  },
  "scenarios": [
    {
      "name": "nominal",
      "factor": 1.0,
      "note": "A manual build writes an equivalent of every generated line."
    },
    {
      "name": "conservative",
      "factor": 0.5,
      "note": "A hand-built system may need only about half the generated line count (less generality, fewer harness layers)."
    }
  ],
  "steps": [
    {
      "step_key": "SysPlanAndReq.1",
      "granularity": "exact_step",
      "status": "done",
      "measures": {
        "sloc_total": 152,
        "by_provenance": {
          "developer_authored": 152
        },
        "unknown_sloc": 0,
        "artifact_ids": [
          "ConOps"
        ],
        "activity": null
      },
      "assurance": null,
      "human_estimates": {
        "experienced_sel4": {
          "hours": 12.67,
          "cost_usd": 1900.5,
          "by_type": {
            "requirements_text": {
              "sloc": 152,
              "hours": 12.67
            }
          },
          "overhead_hours": 0.0
        },
        "new_to_sel4": {
          "hours": 19.0,
          "cost_usd": 2090.0,
          "by_type": {
            "requirements_text": {
              "sloc": 152,
              "hours": 19.0
            }
          },
          "overhead_hours": 0.0
        }
      },
      "agent_actuals": null
    },
    {
      "step_key": "SysPlanAndReq.3",
      "granularity": "exact_step",
      "status": "done",
      "measures": {
        "sloc_total": 48,
        "by_provenance": {
          "developer_authored": 48
        },
        "unknown_sloc": 0,
        "artifact_ids": [
          "CompReqs"
        ],
        "activity": null
      },
      "assurance": null,
      "human_estimates": {
        "experienced_sel4": {
          "hours": 4.0,
          "cost_usd": 600.0,
          "by_type": {
            "requirements_text": {
              "sloc": 48,
              "hours": 4.0
            }
          },
          "overhead_hours": 0.0
        },
        "new_to_sel4": {
          "hours": 6.0,
          "cost_usd": 660.0,
          "by_type": {
            "requirements_text": {
              "sloc": 48,
              "hours": 6.0
            }
          },
          "overhead_hours": 0.0
        }
      },
      "agent_actuals": null
    },
    {
      "step_key": "SysPlanAndReq.4",
      "granularity": "exact_step",
      "status": "done",
      "measures": {
        "sloc_total": 31,
        "by_provenance": {
          "developer_authored": 31
        },
        "unknown_sloc": 0,
        "artifact_ids": [
          "DataDict"
        ],
        "activity": null
      },
      "assurance": null,
      "human_estimates": {
        "experienced_sel4": {
          "hours": 2.58,
          "cost_usd": 387.0,
          "by_type": {
            "requirements_text": {
              "sloc": 31,
              "hours": 2.58
            }
          },
          "overhead_hours": 0.0
        },
        "new_to_sel4": {
          "hours": 3.88,
          "cost_usd": 426.8,
          "by_type": {
            "requirements_text": {
              "sloc": 31,
              "hours": 3.88
            }
          },
          "overhead_hours": 0.0
        }
      },
      "agent_actuals": null
    },
    {
      "step_key": "SysModeling",
      "granularity": "workflow_only",
      "status": "done",
      "measures": {
        "sloc_total": 374,
        "by_provenance": {
          "developer_authored": 374
        },
        "unknown_sloc": 0,
        "artifact_ids": [
          "SysModel"
        ],
        "activity": null
      },
      "assurance": null,
      "human_estimates": {
        "experienced_sel4": {
          "hours": 62.33,
          "cost_usd": 9349.5,
          "by_type": {
            "sysml_model": {
              "sloc": 374,
              "hours": 62.33
            }
          },
          "overhead_hours": 0.0
        },
        "new_to_sel4": {
          "hours": 93.5,
          "cost_usd": 10285.0,
          "by_type": {
            "sysml_model": {
              "sloc": 374,
              "hours": 93.5
            }
          },
          "overhead_hours": 0.0
        }
      },
      "agent_actuals": null
    },
    {
      "step_key": "SysModeling.5",
      "granularity": "exact_step",
      "status": "done",
      "measures": {
        "sloc_total": 0,
        "by_provenance": {},
        "unknown_sloc": 0,
        "artifact_ids": [],
        "activity": "run sireum tipe and fix trivial findings"
      },
      "assurance": null,
      "human_estimates": {
        "experienced_sel4": {
          "hours": 0.25,
          "cost_usd": 37.5,
          "by_type": {},
          "overhead_hours": 0.25
        },
        "new_to_sel4": {
          "hours": 0.38,
          "cost_usd": 41.8,
          "by_type": {},
          "overhead_hours": 0.38
        }
      },
      "agent_actuals": null
    },
    {
      "step_key": "CompGUMBOSpec(*)",
      "granularity": "workflow_only",
      "status": null,
      "measures": {
        "sloc_total": 140,
        "by_provenance": {
          "developer_authored": 140
        },
        "unknown_sloc": 0,
        "artifact_ids": [
          "CompContracts"
        ],
        "activity": null
      },
      "assurance": null,
      "human_estimates": {
        "experienced_sel4": {
          "hours": 46.67,
          "cost_usd": 7000.5,
          "by_type": {
            "gumbo_contract": {
              "sloc": 140,
              "hours": 46.67
            }
          },
          "overhead_hours": 0.0
        },
        "new_to_sel4": {
          "hours": 116.67,
          "cost_usd": 12833.7,
          "by_type": {
            "gumbo_contract": {
              "sloc": 140,
              "hours": 116.67
            }
          },
          "overhead_hours": 0.0
        }
      },
      "agent_actuals": null
    },
    {
      "step_key": "CompGUMBOSpec(mavlinkfirewall)",
      "granularity": "workflow_only",
      "status": "done",
      "measures": {
        "sloc_total": 63,
        "by_provenance": {
          "developer_authored": 63
        },
        "unknown_sloc": 0,
        "artifact_ids": [
          "CompContracts"
        ],
        "activity": null
      },
      "assurance": null,
      "human_estimates": {
        "experienced_sel4": {
          "hours": 21.0,
          "cost_usd": 3150.0,
          "by_type": {
            "gumbo_contract": {
              "sloc": 63,
              "hours": 21.0
            }
          },
          "overhead_hours": 0.0
        },
        "new_to_sel4": {
          "hours": 52.5,
          "cost_usd": 5775.0,
          "by_type": {
            "gumbo_contract": {
              "sloc": 63,
              "hours": 52.5
            }
          },
          "overhead_hours": 0.0
        }
      },